headline,is_satirical
Réarmement : Macron décide et laisse Bayrou se débrouiller pour exécuter,0
Mort de Nahel Merzouk : la tactique de Retailleau pour défendre le policier tireur,0
Wajdi Mouawad au théâtre de la Colline : le départ prématuré d’un directeur engagé,0
Galileo : quand notre école de design sacrifie notre avenir sur l’autel du profit,0
«C’est normal qu’on soit là pour lui» : adorateurs en masse et procureur convaincu à l’ouverture du procès sur la mort de Maradona,0
"Lidl France : après un mois, les salariés «poulpes» toujours mobilisés pour leurs conditions de travail",0
Train attaqué au Pakistan par des séparatistes : tous les otages ont été libérés,0
Valérie Pécresse prépare son retour «dans le bain de la politique nationale»,0
"En Géorgie, la peine de l’ancien président Mikheïl Saakachvili alourdie à neuf ans de prison",0
«Ces derniers jours ont été les pires de notre existence» : des milliers d’alaouites fuient la Syrie et gagnent le Liban,0
Le fabricant suédois de batteries Northvolt se déclare en faillite,0
Australie : des traces de pas de dinosaures vieilles de 200 millions d’années découvertes dans une école,0
"Au Venezuela, le touriste franco-américain Lucas Hunter potentiellement pris au piège de la diplomatie des otages de Nicolás Maduro",0
"La justice bosnienne ordonne l’interpellation de Milorad Dodik, dirigeant sécessionniste des Serbes de Bosnie",0
L’administration Trump continue son offensive contre Ottawa et durcit les règles de séjour pour les Canadiens,0
Pourquoi les Gafam sont au cœur du bras de fer commercial entre Donald Trump et l’UE,0
"Affaire Bétharram : «Bien sûr que monsieur Bayrou sera auditionné par la commission» d’enquête parlementaire, annonce sa présidente",0
Droits de douane : l’Europe doit tenir bon face à Trump,0
"Louane, haut les corons !",0
"Le gardien du PSG Gianluigi Donnarumma, un grand de velours",0
Fonderie de Bretagne : le tribunal de commerce acte une poursuite de la période d’observation,0
«La Nuit sur commande» de Christine Angot : la Bourse et la vie,0
Les nappes phréatiques françaises plus remplies que l’année dernière à la sortie de l’hiver,0
"RSA, allocations familiales, prime d’activité… Plusieurs aides sociales revalorisées à partir du 1er avril",0
La mission permettant le retour des deux astronautes américains coincés dans l’ISS reportée à vendredi,0
"Européennes 2024 : avec des budgets explosés, Marion Maréchal en partie retoquée par la Commission des comptes de campagne",0
Vagues de chaleur marines de 2023 et 2024 : pas de signe d’un emballement climatique,0
La carte vitale désormais disponible sur smartphone,0
Handicap : l’Assemblée supprime le principe du vote «par assis et levé»,0
"Union européenne, Mexique, Chine, Canada… Quelles représailles prévoient ces pays face aux droits de douane de Trump ?",0
"Accusée d’antisémitisme, La France insoumise retire une affiche ciblant Cyril Hanouna",0
Familles monoparentales : la question d’un statut spécifique revient sur la scène politique,0
"Bienvenue à «Pink», le visage le plus ancien de l’évolution humaine en Europe",0
"La Lune va rougir lors d’une éclipse totale, à partir de 7h26 ce vendredi matin en Bretagne",0
"Guerre commerciale avec les Etats-Unis, trêve en Ukraine, affaire Bétharram… L’actu de ce mercredi 12 mars",0
"Négociations sur la trêve en Ukraine : à Djedda, Kyiv retourne la situation, la Russie sous pression",0
«Une histoire animale du monde» d’Eric Baratay : l’animal dans sa peau,0
Un cofondateur du site The Pirate Bay meurt à 64 ans dans un accident d’avion en Slovénie,0
Fusillade à Grenoble : le caïd tué sur l’autoroute dans un règlement de comptes avait disparu des radars depuis près de 25 ans,0
"Au Portugal, les futures législatives anticipées n’arrangent personne, sauf l’extrême droite",0
"Cyril Hanouna en roue libre, les dirigeants de M6 sous pression",0
"Un employé de Bercy soupçonné d’espionnage au profit de l’Algérie, mis en examen",0
Budget de la défense : la menace du rabot social,0
Budget de la défense : les armées dans l’embarras du choix,0
Le patron de RTL nommé directeur général de BFM RMC,0
Budget de la défense : qui va casquer pour l’armée ?,0
"Effort de défense : l’épargne des Français, une réserve difficile à mobiliser",0
"Ligue des champions : face à Dortmund, Lille brade ses illusions",0
"Moscou ordonne à son armée de «libérer de l’ennemi» la région russe de Koursk, Kyiv évoque un repli de ses troupes",0
La Banque de France abaisse sa prévision de croissance pour la France,0
Comment l’obsession de l’obéissance a produit des violences dans l’école catholique,0
"Maltraitance des porcs dans les élevages : après Lidl, L214 vise Leclerc",0
Nouvelle vidéo de L214 : dans l’horreur des élevages de porcs intensifs,0
"A Paris, une nouvelle grève dans les écoles pour défendre le «rôle clé» des directeurs",0
"Ligue des champions : pour le match retour Liverpool-PSG, leurres de vérité",0
"Tech, politique, esbroufe… Jacob Helberg, le nébuleux trait d’union entre Donald Trump et Sarah Knafo",0
Contamination au chlordécone : «Nous n’avons pas de solution miracle pour dépolluer l’environnement»,0
"En Normandie, haut les corps au festival de cirque contemporain Spring",0
Carte «corporate» : les salariés de France TV ont-ils droit à 4 000 euros de frais professionnels par mois ?,0
"Cinq ans pour un bébé (2/5) : «Faire l’amour devient mécanique, c’est même un peu pesant»",0
"Au Soudan du Sud, l’accord de paix au bord de la rupture",0
"Quatre ans après la mort de Maradona, l’heure du procès en Argentine",0
Chute de Wall Street : comment le projet idéologique de Trump fait dévisser les marchés,0
"Pour favoriser les bistrots en zone rurale, l’Assemblée vote l’assouplissement de l’obtention des licences IV",0
"Aux Philippines, Rodrigo Duterte arrêté pour crime contre l’humanité, le «shérif» dans un avion à destination de La Haye",0
"Wall Street dévisse, reprise des négociations attendue entre Ukrainiens et Américains, Duterte arrêté pour crime contre l’humanité… L’actu de ce mardi matin",0
"Attaque massive de drones ukrainiens sur la région de Moscou : un assaut qui doit «inciter» Poutine à accepter une trêve aérienne, selon Kyiv",0
"Syrie : malgré les massacres, il ne faut surtout pas désespérer",0
Pourquoi l’Europe devrait approuver la construction du futur collisionneur de particules du Cern,0
"Le détournement d’usage des terres agricoles, une nouvelle menace pour le foncier",0
Trump achète une Tesla pour soutenir Elon Musk et son entreprise fragilisée,0
Musées et anthropologie : construire l’universel au pluriel ?,0
Un journaliste de BFM Lyon agressé entre deux duplex,0
"Bouygues Telecom touché par une panne nationale dans la nuit, l’incident résolu",0
Comptes de campagne : Marion Maréchal sauvée in extremis par un prêt de 800 000 euros,0
"Avant le congrès du PS, Raphaël Glucksmann déçoit les opposants d’Olivier Faure",0
"Réforme du mode de scrutin à Paris, Lyon et Marseille : le «socle commun» ne sait plus où il habite",0
"Les villes indiennes en tête des métropoles les plus polluées du monde, les îles des Caraïbes et d’Océanie épargnées",0
L’Elysée choisit l’option offensive contre les fausses infos,0
"Photovoltaïque : arrêté tarifaire, baisse de déploiement… La filière du solaire chauffée à blanc par le gouvernement",0
"Les spectacles à voir en ce moment : «le Chant du père» d’Hatice Ozer, «Peer Gynt» d’Henrik Ibsen, «l’Hôtel du libre-échange» de Nordey…",0
Mort de Nahel Merzouk : l’IGPN propose un conseil de discipline pour le policier tireur,0
Fin de la grève du personnel de ménage à Sciences-Po Paris : «On a gagné notre dignité et le respect»,0
«L’odeur fétide du maccarthysme» : stupeur après l’arrestation à New York d’un étudiant palestinien menacé d’expulsion,0
«The Last Showgirl» avec Pamela Anderson : hélas Vegas,0
"En Espagne, la question de la défense européenne bouleverse la scène politique",0
Les cinq milliardaires présents à l’investiture de Trump ont perdu 209 milliards de dollars de fortune personnelle depuis la cérémonie,0
"Introduction du consentement dans la définition du viol : le Conseil d’Etat favorable, le texte examiné à la fin du mois",0
"«It’s the economy, stupid !» : quand Wall Street fait la leçon à Trump et Musk, on ne boude pas son plaisir",0
"Affaire Cendrillon : les casseroles de l’évêque de Dax, symbole de l’inertie de l’Eglise face aux violences",0
"En France, la chaleur a provoqué plus de 3 700 morts à l’été 2024",0
Marseille : un élu PS de la majorité municipale en garde à vue pour une altercation avec des militants LFI,0
Procès de l’affaire Evaëlle : 18 mois de prison avec sursis requis contre l’enseignante jugée pour harcèlement,0
"Isack Hadjar, top départ",0
"Offre avantageuse, augmentation des prix, rentabilité… Trois questions sur l’ouverture de la billetterie estivale de la SNCF",0
"Manus, la nouvelle IA chinoise qui fait sensation : «Dans la bataille des récits, la Chine marque des points»",0
«The Insider» de Steven Soderbergh : agents faciles,0
"Acier, aluminium, voitures : Trump attise la guerre commerciale avec le Canada, avant un énième rétropédalage",0
"Steven Soderbergh, un cinéaste casseur de codes",0
"Après celle de la gare du Nord, avons-nous d’autres bombes de la Seconde Guerre mondiale sous les pieds ?",0
"Pour Macron, la France doit lutter «en même temps» contre «les menaces géopolitiques» et «terroristes»",0
"Portugal : le Premier ministre de centre droit tombe à l’issue d’un vote de défiance, élections anticipées en vue",0
"Objets animés, vous avez donc une vie",0
Chlordécone : l’Etat condamné à indemniser 11 Guadeloupéens et Martiniquais victimes du pesticide,0
"En Syrie, les Kurdes renoncent au fédéralisme et acceptent d’intégrer le nouvel Etat",0
"Plus d’accessibilité, de confort, de fluidité et un bistrot… Le TGV fait sa mue intérieure",0
Donald Trump et Elon Musk font crasher la bourse et les cryptos,0
Guerre d’Algérie : France Télévisions déprogramme un documentaire sur l’usage des armes chimiques par l’armée française,0
Petites à tout prix : à qui les grandes femmes font-elles peur ?,0
"Violences sexuelles : «Black Box Diaries», l’enquête sur les épaules",0
"Harcèlement scolaire : «aucune sanction disciplinaire» pour l’ex-rectrice de Versailles, après le suicide de Nicolas à Poissy",0
"Anne Hidalgo : «Si on est dans le “nous” et pas dans le “je”, on ne perdra pas Paris»",0
"L’économie de guerre ne se décrète pas, elle se prépare",0
"Après la collision de navires en mer du Nord, les fragiles oiseaux marins à la merci de la pollution",0
L’avocat de Boualem Sansal en appelle à l’ONU et à l’Union africaine,0
Evasion d’Amra : un ex-complice de Redouane Faïd fait partie des mis en examen,0
«La Convocation» d’Halfdan Ullmann Tondel : grise de nerfs,0
TGV : Trenitalia ouvre sa billetterie pour ses trains Paris-Marseille à partir de juin,0
"Ukraine : aide militaire et renseignements américains, projet de trêve, minerais… Percée dans les pourparlers Kyiv-Washington",0
"Intérimaires remerciés : à l’usine Renault de Sandouville, «c’est “Koh Lanta”, qui partira, qui restera ?»",0
"Cantines scolaires : le gouvernement veut réautoriser les couverts et assiettes en plastique, la FCPE vent debout",0
Qui pour succéder à Delphine Ernotte ? L’Arcom lance la course à la présidence de France Télévisions,0
«Reine mère» avec Camélia Jordana : à la lueur du lourd,0
"«Il fallait bien que quelqu’un prenne les choses en main» : sur la défense européenne, la France prend la lumière",0
"Guerre en Ukraine, chlordécone, collision en mer du Nord… L’actu de ce mardi 11 mars",0
"Municipales : à gauche, le Paris de la désunion",0
"A Djedda, Ukrainiens et Américains proposent trente jours de cessez-le-feu",0
Collision de deux navires en mer du Nord : «Il faut s’attendre à une pollution plus atmosphérique que marine»,0
Procès du prieur de la communauté de Riaumont : «Je ne connaissais ni le mot fellation ni la réalité de la chose»,0
Défense européenne : Macron reprend du galon,0
"Sécurité, guerre en Ukraine et cote de popularité : pour Emmanuel Macron, la meilleure attaque c’est la défense",0
«Jeunesse imaginaire» : toile de lutte en Roumanie,0
"«Les Loups», dans le bestiaire du temps",0
Saint-Denis : des militants d’extrême droite s’en prennent à des photos de femmes voilées dans une expo à la basilique,0
Municipales à Paris : Rachida Dati au défi de l’unité des droites,0
"«Blue Sun Palace», âmes seules",0
Ligue des champions : le PSG sort Liverpool en gagnant la guerre des goals,0
"Guerre en Ukraine : depuis son allocution, Emmanuel Macron bénéficie de «l’effet drapeau»",0
Pensées décoloniales et universalismes,0
"Eléonore False, collage immédiat",0
"Inondations en Argentine : au moins 16 morts, trois jours de deuil national",0
"Face au «nous contre eux», des solutions existent pour dépolariser les sociétés",0
Plus de 1 000 civils tués : les autorités syriennes annoncent la fin des opérations militaires,0
"Cinq ans pour un bébé (1/5) : «C’est indescriptible, cette envie presque animale de fabriquer un enfant»",0
"Zelensky attendu à Riyad, massacres en Syrie, ouverture du procès de l’affaire Evaëlle… L’actu de ce lundi matin",0
"Guerre en Ukraine : en Arabie Saoudite, Marco Rubio juge «prometteuse» la proposition de cessez-le-feu partiel de Zelensky",0
"Selon Séoul, la Corée du Nord a lancé «plusieurs missiles balistiques»",0
Faire le deuil des lois générales,0
"Clément Bondu, l’augure réalité",0
"Au Théâtre du Châtelet, «Peer Gynt» revient aux fondamentaux avec Olivier Py",0
"Au théâtre de la Colline, Amos Gitaï redonne vie au «Golem»",0
Des criminels créent un faux projet d’attentat contre une synagogue en Australie pour détourner l’attention de la police,0
L’Elysée prend soudain peur devant les médias Bolloré,0
Pourquoi Donald Trump déteste-t-il les scientifiques ?,0
"En dix ans, le tour de Pass Pass Navigo de Valérie Pécresse",0
"Sur la route de la présidentielle 2027, la droite va devoir covoiturer",0
Laurent Wauquiez sommé de donner les noms des invités de ses «dîners des sommets»,0
Violences sexistes et sexuelles dans les transports : le nombre de victimes enregistrées a presque doublé en dix ans,0
"Communauté traditionaliste de Riaumont : un nouveau procès requis, cette fois contre six religieux",0
"Au Groenland, des élections législatives entre envie d’indépendance et menaces de Trump",0
"«Dans les commissariats, il peut exister des décalages entre la réponse policière et les attentes des victimes de violences conjugales»",0
"Menace de guerre : en cinq ans, les importations d’armes des Etats européens membres de l’Otan ont doublé",0
L’Europe ne doit pas sacrifier son exigence sociale et écologique sur l’autel du militaire,0
"Le capitaine arrêté est russe, pas de signe de pollution, un mort… ce que l’on sait après la collision entre deux navires en mer du Nord",0
Les PUF suspendent la parution d’un livre anti-woke aux obsessions trumpistes,0
Ubisoft : le procès pour harcèlement sexuel et moral renvoyé à juin,0
"«Méfiez-vous, c’est souvent des arnaques» : l’influenceur Julien Tanti, sanctionné pour ses pubs pour le trading, publie une vidéo de mise en garde",0
"Les 5 expos du moment : Anne Bourse, M.C. Escher et la famille Commaret…",0
"Pamela Anderson, sage contre son image",0
"Qu’attendons-nous des prisons ? S’il s’agit de se venger, c’est réussi",0
La gauche française fracturée face à l’axe Trump-Poutine,0
"Lettre à une inconnue : la guerre, par Luc Le Vaillant",0
"«Ils ont exécuté les civils et brûlé leurs magasins» : en Syrie, des massacres d’Alaouites plongent le pays dans l’incertitude",0
"Santé mentale : face à la «dépression Trump», soyons en colère",0
"Davey Wreden, créateur de jeux vidéo : «Le cosy game est une sorte de fantasme inatteignable»",0
"Trump ou la diplomatie du Monopoly, par Serge July",0
Changement climatique : le gouvernement lance enfin le plan d’adaptation de la France à une surchauffe future,0
La banque suisse UBS condamnée en France pour le harcèlement moral de deux lanceurs d’alerte,0
Blessure d’Antoine Dupont : le XV de France de nouveau condamné à briller en son absence,0
«Combien de Bétharram ?» : cercueils et scène de crime devant le ministère de l’Education,0
Violences à l’hôpital d’Annemasse : les deux prévenus condamnés à des peines de prison ferme,0
Pollution de l’air : la cuisine à la braise sur le gril,0
"Tesla plonge à Wall Street, sa valorisation divisée par deux depuis décembre",0
Galileo : Elisabeth Borne annonce une inspection sur l’enseignement supérieur privé,0
"Jérôme Fourquet, de l’Ifop, participe-t-il à un forum anti-IVG ?",0
"En Ukraine, trois ans après le siège de Marioupol : «Ce jour-là, je suis face à un choix : dire adieu à mon mari ou courir vers mon enfant»",0
Colonisation de l’Algérie : «Jean-Michel Aphatie a levé le voile sur une vérité historique méconnue du grand public»,0
"Aux Etats-Unis, une censure dans l’art qui s’intensifie et inquiète",0
Réforme de l’audiovisuel public : Laurence Bloch nommée à la tête d’une mission d’accompagnement,0
"A Paris, les chefs d’état-major européens phosphorent sur des garanties de sécurité pour l’Ukraine",0
"Dans les commerces, les paiements en crypto restent menue monnaie",0
Déclaration de revenus : la cryptomonnaie n’échappe pas au fisc,0
"«Milice fasciste» à Rennes : une enquête ouverte après des violences de l’équipe du «Jarl», un ancien candidat d’extrême droite",0
"La présidente mexicaine croit à l’abandon des droits de douanes, Trump parle d’une «transition»",0
"Kérosène, cyanure de sodium… En mer du Nord, l’inquiétante collision d’un pétrolier et d’un porte-conteneurs",0
"En Martinique et Guadeloupe, les vies brisées par le chlordécone seront-elles indemnisées ?",0
"En Guadeloupe, les difficiles efforts vers une filière 0 % chlordécone",0
"Succession de pannes sur X, Elon Musk accuse «un grand groupe ou alors un pays»",0
Produits d’hygiène et de beauté : marche arrière sur les «méga promos»,0
"Négociations de paix : en Arabie Saoudite, des retrouvailles sous tension entre Américains et Ukrainiens",0
"Guerre en Ukraine : Marioupol, de ville martyre à ville vitrine",0
"Guerre en Ukraine : Marioupol, l’expérience de l’indicible",0
"Collision en mer du Nord, plan d’adaptation de la France au changement climatique, réforme de l’audiovisuel public... L’actu de ce lundi 10 mars",0
"Cinq ans après la disparition des toilettes en or de l’artiste Maurizio Cattelan, un procès au tribunal d’Oxford tente de percer le mystère",0
Syrie : accord avec les Kurdes pour intégrer les institutions autonomes à l’Etat,0
"«Si cet arrêté passe, on ferme, c’est mathématique» : à Marseille, des épiceries de nuit visées par un arrêté de fermeture",0
Le pape François va mieux et pourrait quitter prochainement l’hôpital,0
"Guerre commerciale, récession, inflation… Wall Street chute lourdement, plombé par les géants de la tech",0
"Au nom de Yes  : «Close to the Edge», l’album qui a défié les conventions du rock il y a cinquante ans",0
"Au Canada, l’après-Trudeau commence à l’approche des élections",0
"«Aucun parti politique ne nous défend» : en Suède, la tuerie d’Orebro réveille les fractures sociales",0
"Futur Premier ministre du Canada : Mark Carney, le «technocrate accompli» qui veut faire oublier Justin Trudeau",0
"En vue de la présidentielle, Carole Delga passe la seconde",0
La semaine de Coco : la méthode Moscoué de Donald Trump,0
"Près de 200 millions d’euros pour l’Ukraine grâce aux intérêts des avoirs gelés russes, annonce Sébastien Lecornu",0
"Au Théâtre du Rond-Point, la destruction-tion-tion des petites marionnettes",0
"«La Très Catastrophique Visite du zoo» de Joël Dicker, bonne patte",0
"«Chaque année qui passe est une souffrance» : dix ans après le crash mortel de l’émission «Dropped», les familles attendent toujours un procès",0
Le gouvernement réfléchit à accueillir des chercheurs américains dans les universités françaises,0
«Windscreen» : Phil Jung en a sous le capot,0
Morgane Cadignan : «Le disque rayé de mes pensées obsessionnelles»,0
"Michel Goyon, bizarre appliqué",0
"10 articles qui nous ont rendu le sourire cette semaine : des soirées entre femmes, un nouveau pôle santé et une actrice pimpante",0
"Avec Donald Trump, les cryptos gagnent une place de choix à la Maison Blanche",0
"Avec Frédéric Paulin, retour auprès des Français pris au piège de Beyrouth",0
Energie renouvelable : TotalEnergies abandonne un projet de centrale photovoltaïque en Guyane,0
"Dmitry Glukhovsky : «Avec cette guerre, Poutine règle des problèmes personnels pour se trouver une légitimité»",0
Blessure d’Antoine Dupont : ce que l’on sait sur son absence sur le terrain et les sanctions contre les Irlandais,0
"Municipales 2026 : à Toulouse, la course est lancée entre le lièvre insoumis et la tortue socialiste",0
"Jeux paralympiques de Paris : «On a suscité l’envie de faire du parasport, mais sans résoudre le problème de comment le pratiquer»",0
La Chine menace de resserrer «le nœud coulant» autour de Taïwan,0
"«Si je reviens, je reconnais avoir fait une faute» : Jean-Michel Aphatie quitte RTL après ses propos sur la colonisation en Algérie",0
Fermeture du centre Pompidou : l’au revoir aux collections permanentes,0
"En Charente-Maritime, la coûteuse remise en forme du fort Boyard fait grincer quelques dents",0
"Nos critiques des séries de la semaine : «Daredevil», «Nismet» et «A Thousand Blows»",0
"Dans la Creuse, nouvelle terre d’extrême droite : «Si les gens se sentaient bien, ils ne voteraient pas pour de la merde»",0
Etats-Unis : le Secret Service a tiré sur un homme armé près de la Maison Blanche,0
8 mars : le tweet injuste de François Bayrou et la hiérarchisation des causes,0
"En Bolivie, Evo Morales, l’indéboulonnable cacique de la vie politique",0
"Le plan Trump pour déplacer les Gazaouis, Israël coupe l’électricité à Gaza,  nouveaux pourparlers lundi… L’actu du conflit au Proche-Orient ce dimanche 9 mars",0
"Mounia Merzouk, la mère de Nahel, témoigne de son impossible deuil",0
"Laurent Baffie, retour en farce",0
La Russie dit avoir repris trois localités de sa région de Koursk à l’armée ukrainienne,0
"Le sénateur Claude Malhuret, nouvelle icône des opposants à Donald Trump",0
«Historique pour la profession» : le rôle des infirmiers en passe d’être consacré pour la première fois par la loi,0
J’ai testé pour vous : le soin Tokio Inkarami qui envahit les salons de coiffure,0
Biathlon : les relayeurs et relayeuses tricolores remportent la Coupe du monde,0
"Face à la «menace existentielle» russe, l’extrême droite s’accroche à son vieux logiciel",0
Tablettes numériques dans les prisons : que sait-on du programme gelé par Darmanin ?,0
"«Désolé, je ne suis pas en costume» : Zelensky s’excuse avec humour lors d’une cérémonie à Kyiv, référence au clash à la Maison Blanche",0
"Présidence du Conseil constitutionnel : Richard Ferrand, fidèle de Macron à l’épreuve des «sages»",0
Nordey s’invite à l’hôtel de passe-passe de Feydeau,0
"Violences meurtrières en Syrie, les croisés d’Antoine Dupont, la polémique Aphatie... L’actu de ce week-end des 8 et 9 mars",0
"Près de Lyon, un concert néonazi empêché par les autorités",0
"A Bruxelles, Berlinde De Bruyckere mène grand crin",0
"Face à la pression de Donald Trump, Nicolás Maduro joue la carte migratoire",0
"Harcèlement sexuel et moral, agression sexuelle : l’ancien boy’s club d’Ubisoft devant le tribunal",0
"Avec le procès Ubisoft, le nécessaire exercice d’introspection dans le secteur du jeu vidéo",0
"«Assassin’s Creed Shadows», dernier espoir d’Ubisoft pour oublier les déboires",0
"Fracturée, la Syrie prise dans une flambée meurtrière : «Ils ont tué des villages entiers»",0
"Tueries en Syrie : «Aujourd’hui, la polarisation confessionnelle du conflit est très inquiétante»",0
"En Roumanie, le candidat d’extrême droite Calin Georgescu, exclu de la présidentielle, voit son appel rejeté",0
"Affaire Evaëlle : pour la première fois, une professeure est jugée pour harcèlement sur une élève, qui s’était suicidée",0
"Asfar Shamsi, Gisèle Pape, Ezra Collective, Juliette Magnevasoa... La playlist du cahier musique de «Libération»",0
«La fête est un révélateur des crises de notre société»,0
"«Femme, vie, liberté» de Mortaza Behboudi : une ode au courage des Iraniennes",0
Top des ventes de livres : Joël Dicker fait rugir le classement,0
"Covid, retraites, immigration… Les neuf années «intenses» de Laurent Fabius à la tête du Conseil constitutionnel",0
Conseil constitutionnel : peut-on se dire «Sage» sans déontologie ?,0
"Malgré les menaces de Trump, la Russie poursuit ses frappes mortelles en Ukraine",0
