headline,is_satirical
"François Bayrou, cent jours à Matignon et un début de plan pour éviter l’immobilisme",0
Rencontre Russie-Etats-Unis à Riyad sur la guerre en Ukraine : beaucoup de bruit pour quoi ?,0
Un danseur se filme dans un aéroport et embrase les réseaux sociaux,0
"Alimentation : Trop gourmands, trop chers, les insectes n’ont pas tenu «leurs promesses»",0
Camille Etienne et Théodore Tallent : «Le backlash écologique est largement surestimé»,0
"Municipales à Paris : Agnès Buzyn, ex-candidate Renaissance, ne soutiendra pas Rachida Dati en 2026",0
"Nadia Tereszkiewicz, fougue sentimentale",0
"«Anatomie d’un suicide», destins maternels",0
Darmanin veut expulser des détenus étrangers pour résorber la surpopulation carcérale : «C’est la chronique d’un échec annoncé»,0
"Les séries de la semaine : «Adolescence», «37 secondes», «Douglas is Cancelled»",0
"Aux Etats-Unis, la mort soudaine d’une ancienne procureure démocrate à 43 ans interroge",0
"Municipales à Paris : David Belliard, 46 ans, remporte la primaire écologiste",0
Gouvernement Bayrou : le Rassemblement national brandit de nouveau la menace d’une censure,0
"Carambolage à Paris, manifestations en Israël et en Turquie, agression antisémite à Orléans… L’actu de ce week-end des 22 et 23 mars",0
Rabbin frappé à Orléans : «J’ai vu un juif se faire agresser parce qu’il est juif»,0
Canada : des élections législatives anticipées le 28 avril «pour faire face au président Trump»,0
Israël à l’offensive dans le sud de Gaza,0
"En Serbie, Turquie, Israël, la rue est-elle le peuple ?",0
Groenland : le Premier ministre dénonce une «ingérence étrangère» avant la visite d’une délégation américaine,0
Manifestations en Turquie : Erdogan durcit la répression et plonge l’économie dans la tourmente,0
"Vent de fronde en Israël : «Tout ce dont Nétanyahou se soucie, c’est de rester au pouvoir»",0
Féminicide de Chahinez Daoud : un meurtre si prévisible en procès,0
Féminicide de Chahinez Daoud : des dysfonctionnements à l’origine d’une remise en cause du fonctionnement de la police,0
"Chahinez Daoud, de victime à symbole",0
"Les fausses photos porno, les collégiens et l’IA : dans la Manche, Saint-Hilaire-du-Harcouët secoué par une affaire sordide",0
"Philippe Gosselin, député LR : «L’affaire des deepfakes de la Manche est singulière par son ampleur»",0
"«Alfred Dreyfus, vérité et justice», enfer sensible",0
Piétonnisation et végétalisation des rues à Paris : 66 % des votants pour étendre le dispositif,0
Les Bleus prennent la Croatie au colback pour s’offrir un come-back,0
"Top des ventes de livres : «Hunger Games», un éléphant dans un jeu de quilles",0
"Coffret Bluray : «Compañeros», guerre et péon",0
"Un syndicaliste agricole assassiné en Corse, les obsèques organisées ce samedi",0
Energie noire et expansion de l’univers : «La physique standard ne suffit plus pour décrire ce qu’on observe»,0
"«Quand on adapte une ville aux enfants, on l’adapte pour tout le monde»",0
"«Comment être contre cette idée ?» : à Paris, les rues piétonnes veulent faire école",0
Les manifestations contre le racisme ce samedi éclipsées par la polémique autour de LFI et son affiche,0
"Ben PLG, pour la gloire des siens",0
"Parfums «de niche» : derrière l’odeur de l’exclusivité, un marché au bord de l’overdose ?",0
"Mort du boxeur américain George Foreman, la plus célèbre «victime» de Mohammed Ali",0
"Le top 10 de la semaine du service culture : «Baby», «l’Amante anglaise», «Assassin’s Creed Shadows»…",0
"Turquie, Corée du Sud, Europe… Face à la pénurie d’œufs, Washington appelle l’étranger à la rescousse",0
Terreur Graphique à l’hôtel Europa : we will survive,0
Retraites : les gogos de la négo,0
"Parole d’amateurs de touch, sport dérivé du rugby : «Je n’avais pas envie de rentrer avec l’œil tuméfié, la côte cassée ou le corps plein de bleus»",0
Royaume-Uni : retour à la normale à l’aéroport de Londres-Heathrow après une gigantesque panne de courant,0
«Sauvons les Kevin» : les parias se rebiffent,0
"Reprise des hostilités au Liban, appel au cessez-le-feu à Gaza, polémique autour de frappes sur un hôpital… L’actu du conflit au Proche-Orient ce samedi 22 mars",0
Yuji Susaki : les voyeurs sont-ils des voyants ?,0
"Les Etats-Unis mettent fin au statut légal de plus de 500 000 migrants, indignation des associations",0
"10 articles qui nous ont réconfortés cette semaine : un pharaon, un croco, un dessert et des oiseaux",0
"Critiqué pour le flou de sa feuille de route, Bayrou dégaine un programme",0
Thandiwe Muriu au musée de l’Homme : étoffe de soi,0
«Aden ou la transparence de l’air» d’Olmo : par démon et par vaux,0
Une station balnéaire de Toscane prise d’assaut par des millions de moucherons,0
"Immunité, concentration, énergie… grâce aux «champignons adaptogènes»? Mycose toujours",0
Censure de «la Belle et la Bête» de Jul : un inquiétant rétropédalage,0
Les PUF vont bien publier le 30 avril leur ouvrage collectif titré «Face à l’obscurantisme woke»,0
La semaine de Coco : détrumpez-vous,0
"Fin de vie : en Espagne, un père fondamentaliste essaie d’empêcher sa fille paraplégique de mourir",0
Paris : 13 blessés dont 10 policiers après un refus d’obtempérer et une collision spectaculaire,0
"Blasé, James Loup, Loane Coste, Lizzo, Ricky Hollywood: la playlist du cahier musique de «Libération»",0
«La Ligne» d’Aharon Appelfeld : le fils errant,0
"Milan San-Remo 2025 : Lorena Wiebes en artiste de la renaissance, Mathieu van der Poel en champion de la résistance",0
"Frappée au portefeuille, l’université Columbia accepte les réformes voulues par Trump",0
"Une femme tuée au couteau dans le Nord, son mari en garde à vue",0
La France ne doit pas livrer le militant antifasciste Rexhino Abazaj à Viktor Orbán,0
"Fake news sur Brigitte Macron, nouvelle munition des Russes… et des Américains, par Daniel Schneidermann",0
"«37 Secondes» sur Arte, pêche en haut trouble",0
"Réunionnais arrachés à leurs familles entre 1962 et 1984, les «enfants de la Creuse» sur le point d’obtenir une réparation financière",0
Interdiction du voile dans le sport : de l’idéal olympique au repli identitaire,0
"«Poème dégénéré» de névé dumas lu par Edna Eden, traductrice",0
Olivier Faure promet une «grande remise à plat» pour 2027… et le congrès du PS,0
"«Il faut modérer ce qu’on dit et ce qu’on fait» : à Paris, une manifestation dans le calme contre l’extrême droite",0
Le pape sort de l’hôpital ce dimanche avant d’entamer une «longue convalescence»,0
"Turquie : le maire d’Istanbul dénonce des «accusations immorales et sans fondement», de nouveaux rassemblements de soutien massifs",0
Israël : des dizaines de milliers de personnes dans les rues contre Nétanyahou,0
Le député LFI Thomas Portes demande une commission d’enquête sur les groupuscules d’extrême droite,0
"Avec le réchauffement climatique, les irréductibles glaciers asiatiques du Karakoram et du Kunlun flanchent à leur tour",0
"L’aéroport de Londres-Heathrow, le plus grand d’Europe, fermé jusqu’à ce soir en raison d’une panne de courant, au moins 1 000 vols affectés",0
«On m’a trouvée grandie» trouve la formule magique à la Grande Halle de la Villette,0
"En Israël, une purge nocturne par le gouvernement Nétanyahou et «l’ombre d’une guerre civile»",0
"L’audioprothèse, nouveau blockbuster de la fraude à l’Assurance maladie",0
Renaissance aborde les municipales 2026 avec «humilité»,0
"Confidences de confinement : «Je ne sais pas quoi cocher sur l’attestation, l’amour clandestin n’est pas un motif valable»",0
Panne et messageries cryptées : une nuit agitée pour l’Assemblée sur le narcotrafic,0
"Chez LR, le fantôme de la primaire «maudite» à l’ombre du duel Retailleau-Wauquiez",0
"Incendie à l’aéroport de Londres, RSA sous conditions, verdict pour Mehdi Nemmouche… L’actu de ce vendredi matin",0
Epidémie de chikungunya : deux morts confirmés à la Réunion,0
"Vents violents dans le Sud : des milliers de foyers privés d’électricité, un mort dans l’Hérault",0
«La Belle et la Bête» de Jul refusée par l’éducation nationale : «Il y a une scène où le père paraît ivre. Est-ce qu’on censure un ouvrage pour ça ?»,0
"Accident d’avion à Toronto : l’appareil est descendu trop vite, selon un rapport",0
"Soudan : l’armée a repris le palais présidentiel, occupé depuis deux ans par les paramilitaires",0
RSA : vers une suspension de 30 à 100 % de l’allocation en cas de non-respect des quinze heures d’activité par semaine,0
"Ukraine, Gaza : devenons-nous insensibles aux injustices, aux massacres ?",0
"Recette d’Iran : un tah-tchin aux épinards, aux pruneaux et à l’agneau",0
L’idée pas très diplomatique de David Lisnard pour faire libérer Boualem Sansal,0
"Avec 10 euros max, nos 10 restos préférés pour manger assis un bon plat pas cher à Paris",0
"«L’Epoux» de Patrick Autréaux, sa déclaration",0
Saura-t-on ne pas courir dans le sens du vent ? par Lola Lafon,0
"Israël menace d’annexer Gaza, la destitution du chef du Shin Bet suspendue… L’actu du conflit au Proche-Orient ce vendredi 21 mars",0
Près de 9 000 morts en 2024 : il n’y a jamais eu autant de décès sur les routes migratoires dans le monde,0
Premier procès de Gérard Depardieu pour violence sexuelle : des années d’impunité en question,0
Le Conseil constitutionnel censure en partie la loi d’orientation agricole,0
«Respirer à fond» de Rita Halász : pour le meilleur et pour l’expire,0
"Accusé de viol et de violences, l’ancien champion de MMA Conor McGregor veut devenir président de l’Irlande",0
"Madame Dati, pourquoi vouloir encore affaiblir l’audiovisuel public quand la Russie, la Chine et les Etats-Unis parasitent nos médias ?",0
"«Dire, ne pas dire», ce n’est pas la grammaire à boire",0
"Députés RN, complotistes, journalistes du «JDD» et chanteur néofasciste : à Paris, la soirée secrète de toutes les extrêmes droites",0
Assistants parlementaires fictifs du RN : Jordan Bardella perd un procès contre «Libération»,0
Gaza : deux Français «sérieusement blessés» par des bombardements sur des bâtiments de l’ONU,0
Edouard Philippe porte plainte après avoir reçu une menace de mort et une douille usagée dans un courrier,0
Jean-Marc Morandini condamné à deux ans de prison avec sursis en appel pour corruption de mineurs,0
Le Centre-Val de Loire devient la deuxième région à proposer un congé menstruel à ses 2 200 fonctionnaires,0
"En librairies : Nicolas Carreau, Jessica Martin et Alice Austen...",0
Silence on joue ! Spécial «Assassin’s Creed Shadows»,0
«La Cour maudite» d’Ivo Andrić : règlement de contes,0
"Simon Weisse, maquettiste : «Avec Wes Anderson, on a développé un certain style, entre réalisme et petite folie volontaire»",0
"Le PDG d’EDF, Luc Rémont, renvoyé par Macron sur fond de tensions avec l’Etat",0
"RSA : le gouvernement fort avec les faibles, comme d’habitude",0
"C&A envisage la fermeture de 24 magasins, plus de 300 emplois menacés",0
"Pour le peloton féminin, Milan-San Remo Donne, une éclaircie ligure parmi les mauvais augures",0
"Eric de Moulins-Beaufort, épiscopatron",0
Affiche de Cyril Hanouna : LFI condamnée pour atteinte au «droit à l’image»,0
Max Lobe : «Je veux danser dans le cratère bien chaud»,0
"Durée de la fermeture, nombre de passagers concernés, critiques… Ce que l’on sait sur la fermeture de l’aéroport de Londres-Heathrow",0
"Symptômes, mortalité, différences avec Zika et dengue… Ce qu’il faut savoir sur l’épidémie de chikungunya qui sévit à la Réunion",0
Le journal italien «Il Foglio» confie la rédaction de ses articles à l’IA pendant un mois,0
"Lieux prestigieux, son haut de gamme, fauteuils confortables… L’écoute d’album en version immersive",0
Les manifestations étudiantes en Serbie sont «légitimes et essentielles» : l’appel de 3 000 intellectuels contre l’escalade autoritaire du pouvoir,0
"Une campagne intersyndicale inédite pour dire «non» au racisme, à l’antisémitisme et à la xénophobie au travail",0
Trump contre les sciences : «On craint un rebond très rapide du VIH dans certains pays du monde»,0
"Vivian Jenna Wilson, fille d’Elon Musk : «C’est un gros bébé pathétique, pourquoi devrais-je avoir peur de lui ?»",0
La Poste finalement relaxée dans l’affaire de la mort de son sous-traitant Seydou Bagaga,0
"Au cinéma Louxor, des cinéastes en plein cadre",0
Harcèlement à l’école : l’Etat condamné après le suicide d’un collégien de l’Essonne en 2018,0
"«Adaptable aux menaces futures», plus performant, furtif… Trump présente le F-47 de Boeing, avion de combat nouvelle génération",0
"L’armée soudanaise reprend le palais présidentiel, symbole de la reconquête de Khartoum",0
"Une dette commune pour réarmer l’Europe, une idée qui fait son chemin",0
Israël a-t-il largué des tracts sur Gaza affirmant : «La carte du monde ne changera pas si le peuple gazaoui cesse d’exister» ?,0
Islande : la ministre de l’Enfance démissionne après avoir avoué avoir eu un enfant avec un adolescent de 15 ans,0
"Français blessés à Gaza, aéroport d’Heathrow à l’arrêt, le patron d’EDF débranché… L’actu de ce vendredi 21 mars",0
"Elie Barnavi : «Si Nétanyahou refuse d’obéir à la Cour suprême, je n’exclus pas une éruption de violences en Israël»",0
"Contre l’Etat de droit, Nétanyahou pousse Israël au bord de la guerre civile",0
Crise en Serbie : «La réaction de l’UE ira difficilement au-delà d’un appel au calme»,0
"A Lille, «le premier pas de la conquête» d’Arnaud Deslandes, officiellement élu maire",0
"Contre Nétanyahou, l’Etat de droit israélien sur le pied de guerre",0
Procès des geôliers de l’Etat islamique : Mehdi Nemmouche condamné à la réclusion criminelle à perpétuité,0
"L’usine d’armement KNDS à Bourges, emblématique d’une Europe de la défense",0
"Pour avoir grièvement blessé un cycliste à Paris, un motard de la police condamné à 10 mois de prison avec sursis",0
L’émission «Touche pas à mon poste» de Cyril Hanouna va s’arrêter mercredi 26 mars sur sa webtélé,0
"«C’est notre baroud d’honneur pour défendre la démocratie» : en Turquie, les manifestations de soutien au maire d’Istanbul prennent une ampleur inédite",0
"Rétrospective : Albertina Carri, cinéaste très poly",0
"Suppressions de budgets, arrêt du soutien aux musées… Comment la politique de Trump menace le patrimoine fédéral américain",0
Une commission parlementaire pour «empêcher d’autres Bétharram» démarre ses travaux,0
"Statut situationship : «Il a besoin de m’avoir auprès de lui, mais dès que je me rapproche trop, ça l’angoisse»",0
C’est quoi cette façon de voir le mal partout ? par Tania de Montaigne,0
«La censure est évidente et elle est pharaonique» : Jul dénonce l’annulation par l’éducation nationale d’une commande de sa «Belle et la Bête»,0
"Libération d’Olivier Grondeau, en prison en Iran depuis 2022, un autre Français a pu quitter le territoire",0
"Têtes couronnées, anciens médaillés olympiques, actrice oscarisée... : un casting hétéroclite pour élire le président du CIO",0
"Coe, Lappartient, Samaranch Junior… Qui sont les candidats à la succession de Thomas Bach à la tête du CIO ?",0
"Dans «Béhémoth», Franz Neumann ou le nazisme comme chaos organisé",0
"«34 m²» de Louise Mey, les chiffres et les mots de la violence",0
«Chouette d’or» : les solutions de la chasse au trésor révélées le 2 mai au cinéma,0
"Dérèglement climatique : l’océan, un puits de carbone «incroyablement résilient»",0
"Guerre en Ukraine : un sommet européen prévu à Paris la semaine prochaine, selon Bloomberg",0
"Libération d’un Français détenu en Iran, bombardements à Gaza, le «conclave» en sursis… L’actu de ce jeudi matin",0
Etats-Unis : Donald Trump démantèle par décret le ministère de l’Education,0
Cannabis médical en France : une étape administrative clé franchie vers la généralisation des traitements,0
"Réarmement de la France : 1,7 milliard d’euros injectés par les investisseurs publics annoncés par le ministre de l’Economie",0
"La Finlande en tête du classement des pays les plus heureux au monde, les Etats-Unis dégringolent",0
L’influenceur Doualemn interpellé en vue de son expulsion vers l’Algérie,0
«Stand Up for Science» et après ? 2 000 chercheurs demandent des moyens pour que la France soit vraiment un refuge,0
"«La cuisine iranienne, l’une des plus anciennes du monde, est extrêmement variée»",0
La nomination de Dominique Voynet à la tête d’une instance sur le nucléaire fait polémique,0
Budget de la culture et audiovisuel public : les radios France Info et Ici se mettent en grève,0
"Nos choix de livres de la semaine : Roberto Saviano, Patrick Chamoiseau, Jacqueline Manicom…",0
«Rapt» au théâtre Gérard-Philipe de Saint-Denis : tout à fake,0
Pourquoi l’équinoxe de printemps commence ce jeudi 20 mars et non pas le vendredi 21 ?,0
Grippe aviaire : le risque d’une épidémie en France rétrograde de «élevé» à «modéré»,0
L’arrêt de l’A69 révèle l’antagonisme entre droits de l’urbanisme et de l’environnement,0
L’Hyper Cacher de la porte de Vincennes touché par un incendie volontaire,0
"Municipales 2026 : à Lyon, l’hypothèse Jean-Michel Aulas séduit à la fois les Ecologistes et les macronistes",0
Primaire écologiste à Paris : un trio féminin face à David Belliard,0
«Tais-toi !» : le «professeur» Bayrou malmène ses «élèves» ministres,0
Comment bien manger : des Français pleins de bonne volonté mais un peu largués,0
Une réflexion ouverte à l’Assemblée pour en finir avec les séances de nuit,0
L’ex-écolo François de Rugy achève sa mue de droite,0
"«Clochardes», «bougnoules de quartier», «j’adore virer les gens» : Ramdane Touhami, entrepreneur au management brutal",0
"Boualem Sansal : dix ans de prison ferme requis contre l’écrivain franco-algérien, Emmanuel Macron en appelle au président Tebboune",0
Hachette Livre : les élus du CSE dénoncent «la sphère Bolloré» et alertent sur l’impact économique de sa «ligne éditoriale proche de l’extrême droite»,0
"Michelin 2025 : le chef Georges Blanc perd sa troisième étoile, détenue depuis 1981",0
Exécution de quatre Canadiens : la Chine affirme avoir agi «conformément à la loi»,0
"Assurance chômage : la réforme de 2021 a bien frappé les allocataires au portefeuille, mais sans effet positif sur leur précarité",0
"Israël étend son «opération terrestre» à Rafah, tirs de roquettes sur Tel-Aviv, mort d’un cadre du Hamas… L’actu du conflit au Proche-Orient ce jeudi 20 mars",0
Bétharram : l’Etat va-t-il enfin mettre un terme au système autogéré de l’enseignement catholique ?,0
"Anne Vignot, Doubs penchant",0
"«L’Amante anglaise» à l’Odéon : «Peut-être qu’être acteur, c’est laisser les fantômes agir un peu malgré soi»",0
IVG : le Sénat vote une loi réhabilitant les femmes condamnées pour avoir avorté avant la dépénalisation,0
"Scandale des eaux en bouteilles : à l’audition de deux dirigeantes de Nestlé Waters, des sénateurs face à un «système d’omerta»",0
«Complément d’enquête» : l’équipe du film attaque Yann Moix et Gérard Depardieu pour «faux» et «usage de faux»,0
"Première femme présidente du CIO, la Zimbabwéenne Kirsty Coventry change l’incarnation mais pas la ligne",0
Réarmement européen : la défense séduit désormais la finance,0
"Présenté à tort par ChatGPT comme le meurtrier de ses enfants, un homme porte plainte contre l’IA",0
Refaire de la laïcité un instrument de justice sociale et de cohésion républicaine,0
Tesla rappelle tous ses Cybertruck à cause d’un risque de chute de carrosserie,0
"Les forêts animales marines, cet écosystème crucial pour la vie sur Terre, par Claire Nouvian et Baptiste Morizot",0
Comment Dominique Voynet a-t-elle été nommée au Haut Comité pour la transparence et l’information sur la sécurité nucléaire ?,0
"Playboi Carti, Mairo, Benefits, Iliona… Qu’est-ce qu’on écoute cette semaine ?",0
"A Lille, Arnaud Deslandes, un «intérim-maire» en quête de notoriété",0
"«Vous ne devez pas vous taire» : le maire d’Istanbul, en détention, en appelle à la «nation», les manifestants se rassemblent de nouveau",0
Défense : «La valeur des sociétés est deux à cinq fois plus faible que celle d’autres secteurs»,0
«Comme si un avion nous survolait» : que sait-on de l’éventuelle utilisation d’un «canon sonique» contre les manifestants à Belgrade ?,0
Rencontres d’Arles 2025 : en avant toutes !,0
"«Ils portaient des treillis et des bérets rouges, ils nous ont vus et ont commencé à tirer» : à Solenzo, l’armée burkinabè accusée d’une nouvelle tuerie",0
Trump contre les scientifiques : les cas de chercheurs étrangers expulsés ou en passe de l’être se multiplient,0
"Aux Etats-Unis, pourquoi Donald Trump veut supprimer le département de l’Education",0
"Gaîté lyrique : une vingtaine de jeunes migrants placés sous OQTF, selon le collectif",0
"«La culture saigne !» : dans toute la France, les artistes et professionnels du secteur en grève",0
"Viols de Mazan : Gisèle Pelicot va publier ses mémoires, «avec ses propres mots», en janvier 2026",0
"Canicules de deux mois, pics de chaleur à 50°C, nuits suffocantes... A + 4°C, bienvenue dans la France des extrêmes climatiques",0
Retour du gaz russe en Europe : une hypothèse dans les tuyaux,0
"A Paris, trois policiers condamnés pour des violences hors-service devant le pub Saint-Michel",0
"Israël étend son «opération terrestre» à Gaza, Kirsty Coventry prend la tête du CIO, dix ans requis contre Boualem Sansal… L’actu de ce jeudi 20 mars",0
"Crise des urgences : «Le principal problème, c’est le temps passé à chercher un lit d’hospitalisation»",0
La presse va-t-elle tirer un trait sur le dessin ?,0
"Dessin de presse : Ann Telnaes, une caricaturiste américaine en lutte contre la censure",0
"Mathilde Panot : «Face à l’extrême droite, le principal ennemi est la résignation»",0
Sons de la nature : quand les chants d’oiseaux nous donnent des ailes,0
Violences sexuelles : Joël Le Scouarnec reconnaît sa culpabilité pour l’intégralité des 299 victimes,0
"Avec les piafs, la vie en rose",0
"Mortalité infantile : la France parmi les moins bons élèves de l’UE, selon une étude de l’Ined",0
Retraites : les derniers membres du «conclave» tentent de redonner un sens à leurs discussions,0
«Jeunesse perdue» de Pietro Germi : Rome dans une fac de sang,0
"«Vermiglio ou la mariée des montagnes», austère d’accueil",0
Fredrik Wesslau : «Nous sommes encore très loin de la fin de la guerre en Ukraine»,0
"«Lumière ! L’aventure continue», le bonheur est dans les prémices",0
"«Quelque chose de vieux, quelque chose de neuf, quelque chose d’emprunté» : bookmakers à l’ouvrage",0
"«The Alto Knights», deux Niro et un zéro",0
Affiche de Cyril Hanouna : LFI s’enlise dans la crise,0
"Avec Olivier Faure, le PS doit confronter radicalement l’ordre établi",0
"«En voulant maintenir la pression sur Alger, Bruno Retailleau sert uniquement ses ambitions de politique intérieure»",0
"Assurances-vie, livret A… Comment Bercy veut que les banques aident à financer l’effort de défense",0
Guerre en Ukraine : Donald Trump suggère que les Etats-Unis prennent possession des centrales ukrainiennes,0
Europe de la défense : l’industrie de l’armement se relance entre alliances et rivalités nationales,0
Les deux astronautes coincés dans l’ISS ramenés sur Terre à bord d’un appareil de SpaceX,0
Trump contre les scientifiques (5/5) : «Je ne crois pas que la démocratie américaine va tenir le choc face à Trump»,0
"Treize morts à Gaza, nouvelles frappes en Ukraine, retour des deux astronautes sur terre… L’actu de ce mercredi matin",0
"Gaza : après les bombardements, l’armée israélienne annonce le lancement d’«opérations terrestres ciblées»",0
Ports africains : Vincent Bolloré visé par une plainte pour recel et blanchiment,0
"Après son émission sur Decathlon et les Ouïghours, «Cash Investigation» accusé de bidonnage et visé par une violente campagne de Pékin",0
"Incendies au Canada, inondations à Valence, cyclone Chido… Il n’y a jamais eu autant de déplacés climatiques depuis 2008",0
"Turquie : opposant à Erdogan, le maire d’Istanbul Ekrem Imamoglu arrêté, accusé de «soutien à une organisation terroriste»",0
"Retraites : la CGT quitte le «conclave», la CFDT veut en «ouvrir un autre», en fixant de nouvelles modalités",0
RDC : une rencontre surprise entre Félix Tshisekedi et Paul Kagame au Qatar,0
"Confidences de confinement : «Nous voilà une dizaine dans l’appartement d’Alice, sans Alice»",0
63 ans des accords d’Evian : poursuivre le travail de mémoire,0
La justice française s’oppose à l’extradition vers l’Algérie d’un ancien ministre de Bouteflika,0
A qui sert vraiment une nouvelle «Maison des cultures urbaines» à Paris ?,0
"Recette iranienne : le koukou sabzi, une omelette aux fines herbes",0
